<?xml version="1.0" encoding="UTF-8"?>
<config xmlns:xsi="http://www.w3.org/2001/XMLSchema-instance"
        xsi:noNamespaceSchemaLocation="https://raw.githubusercontent.com/shopware/platform/master/src/Core/System/SystemConfig/Schema/config.xsd">
    <card>
        <title>Listing</title>
        <title lang="de-DE">Produktliste</title>

        <input-field type="bool">
            <name>allowBuyInListing</name>
            <label>show buy button in listing</label>
            <label lang="de-DE">Kaufenbutton im Produktlisting anzeigen</label>
        </input-field>
    </card>
</config>