<?xml version="1.0" encoding="UTF-8"?>
<config xmlns:xsi="http://www.w3.org/2001/XMLSchema-instance"
        xsi:noNamespaceSchemaLocation="https://raw.githubusercontent.com/shopware/platform/master/src/Core/System/SystemConfig/Schema/config.xsd">
    <card>
        <title>Privacy</title>
        <title lang="de-DE">Datenschutz</title>

        <input-field type="bool">
            <name>doiNewsletter</name>
            <label>Newsletter Double-Opt-in</label>
            <helpText>Enables Double-Opt-in for newsletters</helpText>
            <helpText lang="de-DE">Aktiviert Double-Opt-in f√ºr Newsletter</helpText>
        </input-field>
    </card>
</config>